Title,Published,URL,Source
A U.S. attack on Iran would show the limits of China's power,2025-06-20 04:47:40,https://economictimes.indiatimes.com/news/international/global-trends/a-u-s-attack-on-iran-would-show-the-limits-of-chinas-power/articleshow/121966688.cms,The Times of India
Fire erupts near Microsoft office in southern Israel as Iran continues offensive: Reports,2025-06-20 04:46:04,https://economictimes.indiatimes.com/news/defence/fire-erupts-near-microsoft-office-in-southern-israel-as-iran-continues-offensive-reports/articleshow/121966508.cms,The Times of India
Fordow countdown | Report: Israel considers unilateral action on Iran nuclear site,2025-06-20 04:45:50,https://www.israelnationalnews.com/news/410349,Israelnationalnews.com
Trump Buys Himself Time,2025-06-20 04:43:05,https://politicalwire.com/2025/06/20/trump-buys-himself-time/,Politicalwire.com
Air India Trims Long-Haul Services by 15%: These Routes are Affected,2025-06-20 04:42:47,http://skift.com/2025/06/20/air-india-trims-long-haul-services-by-15-these-routes-are-affected/,Skift
Markets open flat amid Middle East tensions; FIIs continue buying streak,2025-06-20 04:40:42,https://www.thehindubusinessline.com/markets/stock-markets/markets-open-flat-amid-middle-east-tensions-fiis-continue-buying-streak/article69716138.ece,BusinessLine
Asian shares are mixed and oil gains as world waits to see if US will join Israel's war against Iran,2025-06-20 04:38:29,https://abcnews.go.com/US/wireStory/asian-shares-mixed-oil-gains-world-waits-us-123029165,ABC News
Iran Hijacking Home Security Cameras to Spy Within Israel,2025-06-20 04:35:53,https://biztoc.com/x/0e0f95065017b148,Biztoc.com
Commerce Ministry to meet stakeholders to assess impact of Iran-Israel conflict on India's trade,2025-06-20 04:35:41,https://economictimes.indiatimes.com/news/india/commerce-ministry-to-meet-stakeholders-to-assess-impact-of-iran-israel-conflict-on-indias-trade/articleshow/121966523.cms,The Times of India
Mild recovery in India bonds; key debt auction to decide next direction,2025-06-20 04:35:26,https://economictimes.indiatimes.com/markets/bonds/mild-recovery-in-india-bonds-key-debt-auction-to-decide-next-direction/articleshow/121966515.cms,The Times of India
Iran Hijacking Home Security Cameras to Spy Within Israel,2025-06-20 04:33:42,https://financialpost.com/pmn/business-pmn/iran-hijacking-home-security-cameras-to-spy-within-israel,Financial Post
"Eighth day of the Israel-Iran conflict: Anxiety over Trump’s decisions, mobility in the EU to find a diplomatic solution",2025-06-20 04:29:30,https://en.protothema.gr/2025/06/20/eighth-day-of-the-israel-iran-conflict-anxiety-over-trumps-decisions-mobility-in-the-eu-to-find-a-diplomatic-solution/,Protothema.gr
Rupee rises 13 paise to 86.60 against US dollar in early trade,2025-06-20 04:27:59,https://economictimes.indiatimes.com/markets/forex/rupee-rises-13-paise-to-86-60-against-us-dollar-in-early-trade/articleshow/121966361.cms,The Times of India
"Japan evacuates about 90 citizens from Israel, Iran",2025-06-20 04:24:24,https://biztoc.com/x/7fdfd08b65c14724,Biztoc.com
"Lower Gas Prices to Spur Record July Fourth Road Trips, AAA Says",2025-06-20 04:23:29,https://financialpost.com/pmn/business-pmn/lower-gas-prices-to-spur-record-july-fourth-road-trips-aaa-says,Financial Post
Sergio Mora Urges Jaron ‘Boots’ Ennis to Fight Israil Madrimov in 154-lb Debut: A Bold Move for a Statement Victory?,2025-06-20 04:20:10,https://www.boxingnews24.com/2025/06/sergio-mora-urges-jaron-boots-ennis-to-fight-israil-madrimov-in-154-lb-debut-a-bold-move-for-a-statement-victory/,Boxingnews24.com
Cormac Ó hEadhra is a smart guy but he asks some pretty dumb questions,2025-06-20 04:16:00,https://www.irishtimes.com/culture/tv-radio/2025/06/20/cormac-o-headhra-can-ask-some-pretty-dumb-sounding-questions-for-a-smart-guy/,The Irish Times
트럼프發 지정학적 긴장 고조,2025-06-20 04:15:52,https://ryueyes11.tistory.com/511689,Tistory.com
